{
  "id": "STORY-CHECKOUT-01",
  "epic_id": "EPIC-CHECKOUT",
  "title": "Customer checks out at a server-computed total",
  "format": "classic_user_story",
  "card": {
    "as_a": "logged-in customer",
    "i_want": "to review my cart, address, coupon, shipping and net total before paying",
    "so_that": "I pay exactly what the system computed, not a tampered client value"
  },
  "context": "Totals are computed server-side; shipping is free at >= 1500 THB else 60 THB; one coupon, floored at 0; the coupon is re-validated at confirm and a double-click yields exactly one order.",
  "acceptance_criteria": [
    {
      "scenario_name": "server-computed total with coupon and shipping",
      "scenario_type": "happy",
      "given": [
        "a cart subtotal of 1200 THB with coupon WELCOME100 (-100) and an in-region address"
      ],
      "when": "the customer confirms the order",
      "then": [
        "the server computes total = 1160 THB (1200 - 100 + 60 shipping)",
        "an order is created in awaiting-payment with reserved stock"
      ]
    },
    {
      "scenario_name": "coupon expired during browsing",
      "scenario_type": "error",
      "given": [
        "a coupon that expired while the customer browsed"
      ],
      "when": "the customer confirms",
      "then": [
        "the order is rejected with the neutral message 'this coupon is no longer valid'",
        "no order is created and no stock is reserved"
      ]
    },
    {
      "scenario_name": "double-click confirm is idempotent",
      "scenario_type": "banking_grade_idempotency",
      "given": [
        "a confirm already accepted for this idempotency key"
      ],
      "when": "the customer clicks confirm again",
      "then": [
        "the original order is returned",
        "no second order, reservation or charge is created"
      ]
    },
    {
      "scenario_name": "order creation is audited",
      "scenario_type": "banking_grade_audit",
      "given": [
        "any confirm that creates an order"
      ],
      "when": "it resolves",
      "then": [
        "an audit event {event, actor, ts, order_id, total, audit_id} is emitted"
      ]
    }
  ],
  "banking_grade_concerns": {
    "pii_fields": {
      "status": "applies",
      "justification": "the chosen shipping address is direct PII",
      "fields_or_events": [
        "shipping_address"
      ],
      "treatment": "snapshotted into the order; redacted in non-order logs"
    },
    "audit_events": {
      "status": "applies",
      "justification": "order creation is a financial event"
    },
    "idempotency": {
      "status": "applies",
      "justification": "double-click must not create duplicate orders/charges",
      "fields_or_events": [
        "order_confirm"
      ],
      "treatment": "client idempotency key dedup"
    },
    "reversibility": {
      "status": "applies",
      "justification": "a confirm that fails downstream must release reserved stock",
      "compensating_action": "release the stock reserved by this confirm"
    },
    "authn_authz": {
      "status": "applies",
      "justification": "the cart and address must belong to the confirming customer"
    },
    "regulatory": {
      "status": "applies",
      "justification": "Consumer Protection Act / Electronic Transactions Act require the total be shown before payment; resolved"
    },
    "tipping_off": {
      "status": "not_applicable",
      "justification": "no SAR/AML context"
    }
  },
  "priority": "Must",
  "sizing": {
    "story_points": 8,
    "complexity": "high",
    "split_required": false
  },
  "dependencies": {
    "depends_on": [
      "STORY-AUTH-01",
      "STORY-INVENTORY-01"
    ],
    "blocks": [
      "STORY-CHECKOUT-02"
    ]
  },
  "dor_checklist": {
    "format_clear": true,
    "happy_path_present": true,
    "error_path_present": true,
    "banking_grade_evaluated": true,
    "priority_set": true,
    "dependencies_identified": true,
    "sizing_done": true,
    "no_blocking_ambiguities": true
  },
  "requirement_refs": [
    "shoppilot-mvp"
  ],
  "open_questions": [
    "OQ-2"
  ],
  "scope_ref": "../INDEX.json",
  "change_log": [
    {
      "date": "2026-06-01",
      "author": "eliciting-banking-brief-v1.5.0",
      "change": "Created from requirement shoppilot-mvp"
    }
  ]
}
