{
  "id": "STORY-AUTH-02",
  "epic_id": "EPIC-AUTH",
  "title": "Customer refreshes an expired session securely",
  "format": "classic_user_story",
  "card": {
    "as_a": "logged-in customer",
    "i_want": "to refresh my access token",
    "so_that": "I stay logged in without re-entering credentials and without weakening security"
  },
  "context": "Refresh-token rotation must be atomic and replay-resistant so a stolen or duplicated refresh token cannot mint extra sessions.",
  "acceptance_criteria": [
    {
      "scenario_name": "rotate refresh token",
      "scenario_type": "happy",
      "given": [
        "a valid, unexpired refresh token"
      ],
      "when": "the customer requests a refresh",
      "then": [
        "a new access+refresh pair is issued",
        "the previous refresh token is revoked"
      ]
    },
    {
      "scenario_name": "replayed refresh token revokes the family",
      "scenario_type": "error",
      "given": [
        "a refresh token that was already used"
      ],
      "when": "the customer presents it again",
      "then": [
        "the request is rejected",
        "the entire token family is revoked"
      ]
    },
    {
      "scenario_name": "concurrent refresh is idempotent",
      "scenario_type": "banking_grade_idempotency",
      "given": [
        "two simultaneous refresh requests with the same token"
      ],
      "when": "both are processed",
      "then": [
        "exactly one rotation occurs",
        "only one new pair is issued; the other request fails closed"
      ]
    },
    {
      "scenario_name": "refresh is audited",
      "scenario_type": "banking_grade_audit",
      "given": [
        "any refresh"
      ],
      "when": "it resolves",
      "then": [
        "an audit event with {event, actor, ts, outcome, audit_id} is emitted"
      ]
    }
  ],
  "banking_grade_concerns": {
    "pii_fields": {
      "status": "not_applicable",
      "justification": "operates on opaque tokens, not PII"
    },
    "audit_events": {
      "status": "applies",
      "justification": "refresh and revocation are security events"
    },
    "idempotency": {
      "status": "applies",
      "justification": "rotation must be atomic so concurrent refreshes cannot double-issue",
      "fields_or_events": [
        "refresh_rotation"
      ],
      "treatment": "single-use token with family revocation"
    },
    "reversibility": {
      "status": "not_applicable",
      "justification": "rotation is forward-only; revocation is the safety control"
    },
    "authn_authz": {
      "status": "applies",
      "justification": "session-continuity boundary"
    },
    "regulatory": {
      "status": "not_applicable",
      "justification": "no regulated data beyond the credential already covered in AUTH-01"
    },
    "tipping_off": {
      "status": "not_applicable",
      "justification": "no SAR/AML context"
    }
  },
  "priority": "Should",
  "sizing": {
    "story_points": 5,
    "complexity": "medium",
    "split_required": false
  },
  "dependencies": {
    "depends_on": [
      "STORY-AUTH-01"
    ],
    "blocks": []
  },
  "dor_checklist": {
    "format_clear": true,
    "happy_path_present": true,
    "error_path_present": true,
    "banking_grade_evaluated": true,
    "priority_set": true,
    "dependencies_identified": true,
    "sizing_done": true,
    "no_blocking_ambiguities": true
  },
  "requirement_refs": [
    "shoppilot-mvp"
  ],
  "open_questions": [],
  "scope_ref": "../INDEX.json",
  "change_log": [
    {
      "date": "2026-06-01",
      "author": "eliciting-banking-brief-v1.4.1",
      "change": "Created from requirement shoppilot-mvp"
    }
  ]
}
