{
  "id": "STORY-ORDER-02",
  "epic_id": "EPIC-ORDER",
  "title": "Admin advances the fulfillment state machine",
  "format": "classic_user_story",
  "card": {
    "as_a": "back-office admin",
    "i_want": "to move a paid order through packing, shipped and delivered",
    "so_that": "customers can track fulfillment and the history stays correct"
  },
  "context": "Transitions are forward-only (paid->packing->shipped[tracking required]->delivered); illegal backward moves are rejected and every transition is audited with the actor.",
  "acceptance_criteria": [
    {
      "scenario_name": "forward transitions with required tracking",
      "scenario_type": "happy",
      "given": [
        "a paid order"
      ],
      "when": "the admin moves it to packing then shipped with a tracking number then delivered",
      "then": [
        "each transition is accepted",
        "the shipped transition is rejected if the tracking number is blank"
      ]
    },
    {
      "scenario_name": "illegal backward transition is rejected",
      "scenario_type": "error",
      "given": [
        "a shipped order"
      ],
      "when": "the admin tries to move it back to packing or to cancel a delivered order",
      "then": [
        "the transition is rejected",
        "the order status is unchanged"
      ]
    },
    {
      "scenario_name": "re-submitting the same transition is idempotent",
      "scenario_type": "banking_grade_idempotency",
      "given": [
        "an order already moved to shipped"
      ],
      "when": "the same shipped transition is submitted again",
      "then": [
        "no duplicate state change occurs",
        "no duplicate audit/notification is produced"
      ]
    },
    {
      "scenario_name": "transition is audited with before/after",
      "scenario_type": "banking_grade_audit",
      "given": [
        "any accepted transition"
      ],
      "when": "it resolves",
      "then": [
        "an audit event {event, actor, ts, order_id, before, after, audit_id} is emitted"
      ]
    }
  ],
  "banking_grade_concerns": {
    "pii_fields": {
      "status": "not_applicable",
      "justification": "the admin operates on order ids and statuses; customer PII view is limited and inventoried in ORDER-01"
    },
    "audit_events": {
      "status": "applies",
      "justification": "each transition must record the acting admin and before/after"
    },
    "idempotency": {
      "status": "applies",
      "justification": "a re-submitted transition must not double-apply",
      "fields_or_events": [
        "order_transition"
      ],
      "treatment": "transition guarded by current-state precondition"
    },
    "reversibility": {
      "status": "applies",
      "justification": "illegal backward transitions are rejected; admin cancel-before-packing releases stock",
      "compensating_action": "reject illegal transitions; release stock on admin cancel before packing"
    },
    "authn_authz": {
      "status": "applies",
      "justification": "only admin role may transition orders"
    },
    "regulatory": {
      "status": "not_applicable",
      "justification": "internal fulfillment operation, no regulated processing"
    },
    "tipping_off": {
      "status": "not_applicable",
      "justification": "no SAR/AML context"
    }
  },
  "priority": "Must",
  "sizing": {
    "story_points": 5,
    "complexity": "medium",
    "split_required": false
  },
  "dependencies": {
    "depends_on": [
      "STORY-CHECKOUT-02"
    ],
    "blocks": []
  },
  "dor_checklist": {
    "format_clear": true,
    "happy_path_present": true,
    "error_path_present": true,
    "banking_grade_evaluated": true,
    "priority_set": true,
    "dependencies_identified": true,
    "sizing_done": true,
    "no_blocking_ambiguities": true
  },
  "requirement_refs": [
    "shoppilot-mvp"
  ],
  "open_questions": [
    "OQ-1"
  ],
  "scope_ref": "../INDEX.json",
  "change_log": [
    {
      "date": "2026-06-01",
      "author": "eliciting-banking-brief-v1.4.1",
      "change": "Created from requirement shoppilot-mvp"
    }
  ]
}
