{
  "id": "STORY-AUTH-01",
  "epic_id": "EPIC-AUTH",
  "title": "Customer logs in with email and password",
  "format": "classic_user_story",
  "card": {
    "as_a": "registered customer",
    "i_want": "to log in with my email and password",
    "so_that": "I can access my profile, cart and orders securely"
  },
  "context": "Authentication boundary for the storefront; credentials are PII under PDPA and the failure message must not enable account enumeration.",
  "acceptance_criteria": [
    {
      "scenario_name": "successful login issues tokens",
      "scenario_type": "happy",
      "given": [
        "a registered customer with valid credentials"
      ],
      "when": "the customer submits a login request",
      "then": [
        "a 15-minute access token and a 14-day refresh token are issued",
        "no password or token value appears in any log"
      ]
    },
    {
      "scenario_name": "wrong password is indistinguishable from unknown email",
      "scenario_type": "error",
      "given": [
        "a registered customer"
      ],
      "when": "the customer submits a wrong password",
      "then": [
        "the request is rejected with the generic message 'email or password is incorrect'",
        "the same message is returned for an unknown email"
      ]
    },
    {
      "scenario_name": "login attempt is audited",
      "scenario_type": "banking_grade_audit",
      "given": [
        "any login attempt"
      ],
      "when": "the attempt resolves",
      "then": [
        "an audit event is emitted carrying {event, actor, ts, outcome, audit_id} with no credential value"
      ]
    }
  ],
  "banking_grade_concerns": {
    "pii_fields": {
      "status": "applies",
      "justification": "email and phone are direct PII; password is a credential",
      "fields_or_events": [
        "customer_email",
        "password"
      ],
      "treatment": "encrypt at rest; one-way hash for password; redact in logs"
    },
    "audit_events": {
      "status": "applies",
      "justification": "login attempts must be auditable for security review"
    },
    "idempotency": {
      "status": "not_applicable",
      "justification": "login is an authn read with no state mutation to replay"
    },
    "reversibility": {
      "status": "not_applicable",
      "justification": "issuing a session has nothing to reverse"
    },
    "authn_authz": {
      "status": "applies",
      "justification": "this story is the authentication boundary itself"
    },
    "regulatory": {
      "status": "applies",
      "justification": "PDPA B.E. 2562 sec. 24 lawful basis for credential handling; citation resolved"
    },
    "tipping_off": {
      "status": "not_applicable",
      "justification": "no SAR/AML context in an e-commerce login"
    }
  },
  "priority": "Must",
  "sizing": {
    "story_points": 5,
    "complexity": "medium",
    "split_required": false
  },
  "dependencies": {
    "depends_on": [],
    "blocks": [
      "STORY-AUTH-02",
      "STORY-CHECKOUT-01"
    ]
  },
  "dor_checklist": {
    "format_clear": true,
    "happy_path_present": true,
    "error_path_present": true,
    "banking_grade_evaluated": true,
    "priority_set": true,
    "dependencies_identified": true,
    "sizing_done": true,
    "no_blocking_ambiguities": true
  },
  "requirement_refs": [
    "shoppilot-mvp"
  ],
  "open_questions": [],
  "scope_ref": "../INDEX.json",
  "change_log": [
    {
      "date": "2026-06-01",
      "author": "eliciting-banking-brief-v1.4.1",
      "change": "Created from requirement shoppilot-mvp"
    }
  ]
}
